{
  "abstract": "We present the first deep learning model to successfully learn control policies directly from high-dimensional sensory input using reinforcement learning. The model is a convolutional neural network, trained with a variant of Q-learning, whose input is raw pixels and whose output is a value function estimating future rewards. We apply our method to seven Atari 2600 games from the Arcade Learning Environment, with no adjustment of the architecture or learning algorithm. We find that it outperforms all previous approaches on six of the games and surpasses a human expert on three of them.",
  "added_at": "2026-08-02T12:00:25Z",
  "aliases": [],
  "authors": [
    {
      "name": "Volodymyr Mnih"
    },
    {
      "name": "Koray Kavukcuoglu"
    },
    {
      "name": "David Silver"
    },
    {
      "name": "Alex Graves"
    },
    {
      "name": "Ioannis Antonoglou"
    },
    {
      "name": "Daan Wierstra"
    },
    {
      "name": "Martin Riedmiller"
    }
  ],
  "collections": [],
  "custom": {},
  "files": {
    "pdf": null
  },
  "id": "1312.5602",
  "provenance": [
    {
      "added_at": "2026-08-02T12:00:25Z",
      "kind": "arxiv",
      "ref": "1312.5602"
    }
  ],
  "published": "2013-12-19",
  "schema_version": 1,
  "source": {
    "id": "1312.5602",
    "pdf_url": "https://arxiv.org/pdf/1312.5602v1.pdf",
    "provider": "arxiv",
    "url": "https://arxiv.org/abs/1312.5602v1",
    "version": 1
  },
  "status": "inbox",
  "tags": [
    "demo",
    "machine-learning"
  ],
  "title": "Playing Atari with Deep Reinforcement Learning",
  "type": "preprint",
  "updated": "2013-12-19",
  "updated_at": "2026-08-02T12:00:25Z"
}
