{
  "abstract": "We introduce Adam, an algorithm for first-order gradient-based optimization of stochastic objective functions, based on adaptive estimates of lower-order moments. The method is straightforward to implement, is computationally efficient, has little memory requirements, is invariant to diagonal rescaling of the gradients, and is well suited for problems that are large in terms of data and/or parameters. The method is also appropriate for non-stationary objectives and problems with very noisy and/or sparse gradients. The hyper-parameters have intuitive interpretations and typically require little tuning. Some connections to related algorithms, on which Adam was inspired, are discussed. We also analyze the theoretical convergence properties of the algorithm and provide a regret bound on the convergence rate that is comparable to the best known results under the online convex optimization framework. Empirical results demonstrate that Adam works well in practice and compares favorably to other stochastic optimization methods. Finally, we discuss AdaMax, a variant of Adam based on the infinity norm.",
  "added_at": "2026-08-02T12:00:30Z",
  "aliases": [],
  "authors": [
    {
      "name": "Diederik P. Kingma"
    },
    {
      "name": "Jimmy Ba"
    }
  ],
  "collections": [],
  "custom": {},
  "files": {
    "pdf": null
  },
  "id": "1412.6980",
  "provenance": [
    {
      "added_at": "2026-08-02T12:00:30Z",
      "kind": "arxiv",
      "ref": "1412.6980"
    }
  ],
  "published": "2014-12-22",
  "schema_version": 1,
  "source": {
    "id": "1412.6980",
    "pdf_url": "https://arxiv.org/pdf/1412.6980v9.pdf",
    "provider": "arxiv",
    "url": "https://arxiv.org/abs/1412.6980v9",
    "version": 9
  },
  "status": "inbox",
  "tags": [
    "demo",
    "machine-learning"
  ],
  "title": "Adam: A Method for Stochastic Optimization",
  "type": "preprint",
  "updated": "2017-01-30",
  "updated_at": "2026-08-02T12:00:30Z"
}
