{
  "abstract": "We present YOLO, a new approach to object detection. Prior work on object detection repurposes classifiers to perform detection. Instead, we frame object detection as a regression problem to spatially separated bounding boxes and associated class probabilities. A single neural network predicts bounding boxes and class probabilities directly from full images in one evaluation. Since the whole detection pipeline is a single network, it can be optimized end-to-end directly on detection performance. Our unified architecture is extremely fast. Our base YOLO model processes images in real-time at 45 frames per second. A smaller version of the network, Fast YOLO, processes an astounding 155 frames per second while still achieving double the mAP of other real-time detectors. Compared to state-of-the-art detection systems, YOLO makes more localization errors but is far less likely to predict false detections where nothing exists. Finally, YOLO learns very general representations of objects. It outperforms all other detection methods, including DPM and R-CNN, by a wide margin when generalizing from natural images to artwork on both the Picasso Dataset and the People-Art Dataset.",
  "added_at": "2026-08-02T12:00:34Z",
  "aliases": [],
  "authors": [
    {
      "name": "Joseph Redmon"
    },
    {
      "name": "Santosh Divvala"
    },
    {
      "name": "Ross Girshick"
    },
    {
      "name": "Ali Farhadi"
    }
  ],
  "collections": [],
  "custom": {},
  "files": {
    "pdf": null
  },
  "id": "1506.02640",
  "provenance": [
    {
      "added_at": "2026-08-02T12:00:34Z",
      "kind": "arxiv",
      "ref": "1506.02640"
    }
  ],
  "published": "2015-06-08",
  "schema_version": 1,
  "source": {
    "id": "1506.02640",
    "pdf_url": "https://arxiv.org/pdf/1506.02640v5.pdf",
    "provider": "arxiv",
    "url": "https://arxiv.org/abs/1506.02640v5",
    "version": 5
  },
  "status": "inbox",
  "tags": [
    "demo",
    "machine-learning"
  ],
  "title": "You Only Look Once: Unified, Real-Time Object Detection",
  "type": "preprint",
  "updated": "2016-05-09",
  "updated_at": "2026-08-02T12:00:34Z"
}
