{
  "abstract": "We present high quality image synthesis results using diffusion probabilistic models, a class of latent variable models inspired by considerations from nonequilibrium thermodynamics. Our best results are obtained by training on a weighted variational bound designed according to a novel connection between diffusion probabilistic models and denoising score matching with Langevin dynamics, and our models naturally admit a progressive lossy decompression scheme that can be interpreted as a generalization of autoregressive decoding. On the unconditional CIFAR10 dataset, we obtain an Inception score of 9.46 and a state-of-the-art FID score of 3.17. On 256x256 LSUN, we obtain sample quality similar to ProgressiveGAN. Our implementation is available at https://github.com/hojonathanho/diffusion",
  "added_at": "2026-08-02T12:41:18Z",
  "aliases": [],
  "authors": [
    {
      "name": "Jonathan Ho"
    },
    {
      "name": "Ajay Jain"
    },
    {
      "name": "Pieter Abbeel"
    }
  ],
  "collections": [],
  "custom": {},
  "files": {
    "pdf": null
  },
  "id": "2006.11239",
  "provenance": [
    {
      "added_at": "2026-08-02T12:41:18Z",
      "kind": "arxiv",
      "ref": "2006.11239"
    }
  ],
  "published": "2020-06-19",
  "schema_version": 1,
  "source": {
    "id": "2006.11239",
    "pdf_url": "https://arxiv.org/pdf/2006.11239v2.pdf",
    "provider": "arxiv",
    "url": "https://arxiv.org/abs/2006.11239v2",
    "version": 2
  },
  "status": "inbox",
  "tags": [
    "demo",
    "machine-learning"
  ],
  "title": "Denoising Diffusion Probabilistic Models",
  "type": "preprint",
  "updated": "2020-12-16",
  "updated_at": "2026-08-02T12:43:39Z"
}
