{
  "abstract": "We propose two novel model architectures for computing continuous vector representations of words from very large data sets. The quality of these representations is measured in a word similarity task, and the results are compared to the previously best performing techniques based on different types of neural networks. We observe large improvements in accuracy at much lower computational cost, i.e. it takes less than a day to learn high quality word vectors from a 1.6 billion words data set. Furthermore, we show that these vectors provide state-of-the-art performance on our test set for measuring syntactic and semantic word similarities.",
  "added_at": "2026-08-02T12:41:03Z",
  "aliases": [],
  "authors": [
    {
      "name": "Tomas Mikolov"
    },
    {
      "name": "Kai Chen"
    },
    {
      "name": "Greg Corrado"
    },
    {
      "name": "Jeffrey Dean"
    }
  ],
  "collections": [],
  "custom": {},
  "files": {
    "pdf": null
  },
  "id": "1301.3781",
  "provenance": [
    {
      "added_at": "2026-08-02T12:41:03Z",
      "kind": "arxiv",
      "ref": "1301.3781"
    }
  ],
  "published": "2013-01-16",
  "schema_version": 1,
  "source": {
    "id": "1301.3781",
    "pdf_url": "https://arxiv.org/pdf/1301.3781v3.pdf",
    "provider": "arxiv",
    "url": "https://arxiv.org/abs/1301.3781v3",
    "version": 3
  },
  "status": "inbox",
  "tags": [
    "demo",
    "machine-learning"
  ],
  "title": "Efficient Estimation of Word Representations in Vector Space",
  "type": "preprint",
  "updated": "2013-09-07",
  "updated_at": "2026-08-02T12:43:38Z"
}
