{
  "abstract": "While the Transformer architecture has become the de-facto standard for natural language processing tasks, its applications to computer vision remain limited. In vision, attention is either applied in conjunction with convolutional networks, or used to replace certain components of convolutional networks while keeping their overall structure in place. We show that this reliance on CNNs is not necessary and a pure transformer applied directly to sequences of image patches can perform very well on image classification tasks. When pre-trained on large amounts of data and transferred to multiple mid-sized or small image recognition benchmarks (ImageNet, CIFAR-100, VTAB, etc.), Vision Transformer (ViT) attains excellent results compared to state-of-the-art convolutional networks while requiring substantially fewer computational resources to train.",
  "added_at": "2026-08-02T12:41:20Z",
  "aliases": [],
  "authors": [
    {
      "name": "Alexey Dosovitskiy"
    },
    {
      "name": "Lucas Beyer"
    },
    {
      "name": "Alexander Kolesnikov"
    },
    {
      "name": "Dirk Weissenborn"
    },
    {
      "name": "Xiaohua Zhai"
    },
    {
      "name": "Thomas Unterthiner"
    },
    {
      "name": "Mostafa Dehghani"
    },
    {
      "name": "Matthias Minderer"
    },
    {
      "name": "Georg Heigold"
    },
    {
      "name": "Sylvain Gelly"
    },
    {
      "name": "Jakob Uszkoreit"
    },
    {
      "name": "Neil Houlsby"
    }
  ],
  "collections": [],
  "custom": {},
  "files": {
    "pdf": null
  },
  "id": "2010.11929",
  "provenance": [
    {
      "added_at": "2026-08-02T12:41:20Z",
      "kind": "arxiv",
      "ref": "2010.11929"
    }
  ],
  "published": "2020-10-22",
  "schema_version": 1,
  "source": {
    "id": "2010.11929",
    "pdf_url": "https://arxiv.org/pdf/2010.11929v2.pdf",
    "provider": "arxiv",
    "url": "https://arxiv.org/abs/2010.11929v2",
    "version": 2
  },
  "status": "inbox",
  "tags": [
    "demo",
    "machine-learning"
  ],
  "title": "An Image is Worth 16x16 Words: Transformers for Image Recognition at Scale",
  "type": "preprint",
  "updated": "2021-06-03",
  "updated_at": "2026-08-02T12:43:39Z"
}
